<offer xmlns:xsi="http://www.w3.org/2001/XMLSchema-instance"
      xsi:noNamespaceSchemaLocation="offer.xsd">

    <type>SELL</type>
    <description>ANIMAL_COW</description>
    <price>99.99</price>
    <shop id="1">
        <name>shop2</name>
        <user id="1">
            <login>Saler2</login>
            <password>2222</password>
            <role>SALESMAN</role>
        </user>
    </shop>
</offer>
